name,url,price,sku,rating,review_count,country,local_region,category,process,variety,altitude,harvest,certifications,organic,fair_trade,rainforest_alliance,decaffeinated,cupping_notes,attr_brightness,attr_body,attr_aroma,attr_complexity,attr_balance,attr_sweetness,flavor_spicy,flavor_chocolaty,flavor_nutty,flavor_buttery,flavor_fruity,flavor_flowery,flavor_winey,flavor_earthy,description,watchlist_match,watchlist_farm,watchlist_tier,watchlist_credential_type,watchlist_credential_detail,watchlist_notes,watchlist_url
"Burundi: Twaranyuzwe Co-op, Kavumu",https://www.coffeebeancorral.com/product/Burundi-Twaranyuzwe-Kavumu__BURKAVUMU.aspx,$10.15,BURKAVUMU,5.0,,Burundi,Twaranyuzwe Province,Conventional,Natural,Bourbon,"1,740 - 1,840 masl",April - October,,No,No,No,No,"Pineapple, jam, green apple, and cherry notes with tropical fruit brightness; very high acidity, average body; high sweetness with vibrant fruit-forward character and juicy complexity.",6,4,5,6,5,6,1,1,1,1,4,1,4,1,"This natural processed coffee comes from the Twaranyuzwe cooperative in Kavumu, Burundi, established in 2013 by smallholder coffee farmers. The cooperative's name translates to ""we have understood,"" signifying the members' commitment to understanding and investing in the future of coffee. This lot represents the collective effort of 915 specialty coffee producers, 490 of whom are cooperative members.


The Bourbon varietal cherries are grown at elevations up to 1840 meters above sea level before being transported to the Kavumu Washing Station. Upon arrival, cherries are meticulously sorted to ensure only ripe red cherries proceed to processing. The natural processing method begins with pre-drying in the shade, where intensive sorting removes any remaining defects, followed by 10-15 days of sun drying on raised beds depending on weather conditions.


Harvested in April and exported in October, this coffee showcases the exceptional terroir of Burundi's highlands through its Bourbon genetics. The careful two-stage sorting process and controlled drying create a cup that bursts with tropical fruit character—pineapple and green apple brightness balanced by jammy sweetness and cherry depth—demonstrating why Burundi has emerged as one of Africa's most exciting specialty coffee origins.


Cupping Notes: 
Pineapple, jam, green apple, and cherry notes with tropical fruit brightness; very high acidity, average body; high sweetness with vibrant fruit-forward character and juicy complexity.


Try before you stock up with a half-pound sample!",,,,,,,
CBC Blend: Big Black,https://www.coffeebeancorral.com/product/BigBlackConv__BIGBLACK.aspx,$11.45,BIGBLACKCONV,,,,,CBC Blend,Semi Washed,,,,,No,No,No,No,"Bold, earthy, spicy, and chocolaty notes with a hint of brown sugar and vanilla",3,6,5,6,5,3,3,4,3,1,3,3,1,4,"This new bold earthy coffee blend brings out the best of African and Asian coffee beans with homage to the OG organic version. African coffees are usually described as complex, fruity and floral. These are stronger, fragrant-rich, and full-bodied flavored beans. Asian coffees tend to be earthier and darker than most other regional blends. These coffees tend to be smooth, dense, and exotic with dark chocolate, bold nuttiness, and subtle earthy tones. We think this coffee is best as a dark roast, but your taste will be the final decider! Let us know how you roasted this variety in the product reviews.Try before you stock up with a 1/2 pound sample!",,,,,,,
CBC Blend: Ferdelance,https://www.coffeebeancorral.com/www/Products/Ferdelance-Espresso-Blend__FERDELANCE.aspx,$10.65,FERDELANCE,4.5,,,,CBC Blend,,,,,,No,No,No,No,"Roast it lighter and enjoy a creamy chocolate espresso drink with a dominant nutty taste, or take it to the limit and get the bittersweet end of the spectrum. Very versatile and quite complex.",4,6,5,6,5,5,1,4,4,4,1,1,1,1,"Created by Russ as the perfect single shot, our own Ferdelance blend is one of our favorites for espresso––plenty of crema and lots of nutty richness. While its namesake isn’t precisely straight from Central America’s deadly viper, this mix is still high octane, and it packs a potent, complex bite! It's a potent blend (roasted dark), but also sweet when roasted lighter, and develops a thick crema. Deep and rich-flavored with heavy body and the balance you might expect from a blend so long in development. Roast it lighter and enjoy a creamy chocolate espresso drink with a dominant nutty taste, or take it to the limit and get the bittersweet end of the spectrum. Very versatile and quite complex.Try before you stock up with a 1/2 pound sample!",,,,,,,
CBC Blend: Four Horseman,https://www.coffeebeancorral.com/product/Four-Horsemen-CBC-Blend__FOURBLEND.aspx,$10.40,FOURBLEND,5.0,,,,CBC Blend,,,,,,No,No,No,No,,5,5,5,5,5,4,3,4,1,1,4,1,1,2,,,,,,,,
CBC Blend: High Octane Robusta Blend,https://www.coffeebeancorral.com/www/Products/High-Octane-Blend__HIGHOCTANE.aspx,$11.35,OCTANEBLEND,4.5,,,,CBC Blend,,,,,,No,No,No,No,"Rich, low acidity with notes of dark chocolate, vanilla, and cinnamon with a medium to heavy body and bold, earthy flavors with a big caffeine jolt.",2,4,5,4,6,2,4,4,1,1,1,1,1,4,"Rich, low acidity with notes of dark chocolate, vanilla, and cinnamon with a medium to heavy body and bold, earthy flavors with a big caffeine jolt.",,,,,,,
CBC Blend: Highland,https://www.coffeebeancorral.com/product/Highlands-CBC-Blend__HIGHBLEND.aspx,$9.50,HIGHBLEND,5.0,,,,CBC Blend,,,,,,No,No,No,No,,6,1,1,1,1,1,1,1,1,1,1,1,1,1,,,,,,,,
CBC Blend: Kope Kapuna,https://www.coffeebeancorral.com/product/Kope-Kapuna-CBC-Blend__KAPUNA.aspx,$10.35,KAPUNA,4.5,,,,CBC Blend,,,,,,No,No,No,No,"Chocolaty and fruity, with a hint of spice and just enough heft and body to be truly satisfying.",5,5,5,5,5,4,3,4,1,1,4,1,1,2,"Our Kope Kapuna combination was a 2007 Holiday hit. So rather than keeping the secret limited edition, we decided to make it permanent in our offerings. Russ concocted this bean combo with plenty of Hawaiian flair and nostalgia.  In keeping with the season's pleasures, the Kope Kapuna blend is chocolatey, fruity, and spicy. It’s perfect for a chilly holiday morning––and now, every morning! Year-round, this is our special offering to you. Add your roasting results and tips to the product reviews/comments for everyone to share.Try before you stock up with a 1/2 pound sample!",,,,,,,
CBC Blend: Onobeano's Latte,https://www.coffeebeancorral.com/www/Products/Onobeanos-Latte-Blend__LATTE.aspx,$10.93,Latte,4.5,,,,CBC Blend,,,,,,No,No,No,No,,6,1,1,1,1,1,1,1,1,1,1,1,1,1,,,,,,,,
CBC Blend: Organic Big Black,https://www.coffeebeancorral.com/product/Big-Black-Organic-CBC-Blend__BIGBLACKORG.aspx,$11.96,BIGBLACKORG,4.5,,,,CBC Blend,,,,,,Yes,No,No,No,This bold organic coffee blend brings out the best of African and Asian coffee beans. This blend has a lot of body with both earthy and chocolaty notes - a balanced blend with a touch of spice.,3,6,5,6,5,3,3,4,3,1,3,3,1,4,"This bold organic coffee blend brings out the best of African and Asian coffee beans. African coffees are usually described as complex, fruity and floral. These are stronger, fragrant-rich, and full-bodied flavored beans. Asian coffees tend to be earthier and darker than most other regional blends. These coffees tend to be smooth, dense, and exotic with dark chocolate, bold nuttiness, and subtle earthy tones. We think this coffee is best as a dark roast, but your taste will be the final decider! Let us know how you roasted this variety in the product reviews.Try before you stock up with a 1/2 pound sample!",,,,,,,
"Colombia: Decaf EA, Cauca",https://www.coffeebeancorral.com/product/Colombia-Decaf-EA-Process__COLDECAFEAP.aspx,$9.15,COLDECAFEAP,5.0,,Colombia,Cauca,Decaffeinated,Washed,"Colombia, Caturra, Castillo","1,500 – 2,100 masl",April - July,,No,No,No,Yes,"Candy-like, with notes of tropical fruit and citrus; creamy body",4,5,6,3,4,7,1,2,4,3,4,1,1,1,"Processed with ethyl acetate, (a sweet-smelling organic compound derived from sugar cane created during fermentation) this bean originates from the Andean region’s only decaffeination plant, Descafecol. The plant relies on pure water from the Navado el Ris (a snow-capped volcano resting on the border of Caldas and Tolima) and natural ethyl acetate from sugar cane plants in Palmira, Colombia. From the Trilladora Andes Mill, the coffee’s complete process involves machine-pulping, 6-8 hour fermentation, rinsing and patio-drying for 12 hours, and a final 6-hour drying. The Decaffeination process starts with steaming the green coffee beans at low pressure in order to remove their silver skins. Then, the beans are swelled and softened with hot water, which starts the caffeine's hydrolysis process––water causes the caffeine to break down and separate from the other compounds. In the next step, the ethyl acetate circulates through the beans until at least 97% of the caffeine is removed. Saturated steam is applied at low pressure to remove the ethyl acetate in the final processing stages. Coffee beans are then cooled to ambient temperature, surrounded by fans, and polished with carnauba wax, protecting the beans from humidity. The coffee beans are vacuum-dried in drums to ensure water removal and bring moisture levels to less than 12%. Cupping notes: Candy-like, with notes of tropical fruit and citrus; creamy body. Try before you stock up with a 1/2lb sample!!",,,,,,,
"Colombia: El Gato Supremo, Bucaramanga",https://www.coffeebeancorral.com/product/Colombia-Bucaramanga-El-Gato-Supremo__COLBUC.aspx,$9.05,COLBUC,4.5,,Colombia,Bucaramanga,Conventional,Washed,"Castillo, Colombia, Caturra, Typica","1,000 - 2,000 masl",October - December,,No,No,No,No,"Well-balanced with sweet aromas of brown sugar and maple syrup. Smooth, silky medium body carries bright, crisp winey acidity, complemented by citrus, lemon, orange, red fruit, nectarine, and dark chocolate notes. A clean, lingering finish with sweet, rich complexity.",6,5,5,4,6,6,1,3,1,2,4,2,3,1,"El Gato Supremo is grown through the Santander Department, which is widely known for its natural, shade-grown coffees. These beans are cultivated in rich forests where volcanic soils, idyllic microclimates, and average temperatures between 68 and 71 degrees Fahrenheit are ideal for growing specialty-grade arabica.
 

A proper 17/18 screen Colombia Supremo green coffee, this bean is handpicked, washed, and milled by the Northeastern Colombian Coffee Cooperative (Cooperativa Cafetera Del Nororiente Colombiano).
 
Cupping Notes: Well-balanced with sweet aromas of brown sugar and maple syrup. Smooth, silky medium body carries bright, crisp winey acidity, complemented by citrus, lemon, orange, red fruit, nectarine, and dark chocolate notes. A clean, lingering finish with sweet, rich complexity.

Try before you stock up with a 1/2 pound sample!",,,,,,,
"Colombia: Organic Sierra Nevada FTO, Santa Marta",https://www.coffeebeancorral.com/www/Products/Colombia-Organic-FT-Sierra-Nevada__COLOSIERNEVA.aspx,$11.35,COLOSIERNEVA,4.5,,Colombia,Cesar and Magdalena,Organic,Washed,"Castillo, Caturra, Colombia, Typica","1,200-1,500 masl",September–December,OrganicFair Trade,Yes,Yes,No,No,"Sweet brown sugar aroma, exotic well balanced flavor, clean sweet lingering rich aftertaste and rich smooth silky medium to full body with bright vibrant acidity, orange, raspberry, grapefruit, peach and chocolate notes.",6,5,4,4,6,5,1,2,1,4,4,4,1,1,"This Colombian bean is produced by the TAYRONACA Association, a non-profit organization with over 300 specialty cocoa and coffee producers, half of which are the producers that contribute to Colombia Sierra Nevada TAYRONACA Fairtrade Organic. The TAYRONACA Association has partnered with SENA (National Apprenticeship Service) to provide courses on agricultural practices, phytosanitary control and business management. They are also invested in creating sustainable economic development which maximizes resources, increases productivity and quality. The coffee is handpicked to ensure uniformity then the cherry is machine pulped and undergoes different drying methods: 50% is sundried, 20% on raised beds, and 30% is dried mechanically.

Cupping notes: Sweet brown sugar aroma, exotic well balanced flavor, clean sweet lingering rich aftertaste and rich smooth silky medium to full body with bright vibrant acidity, orange, raspberry, grapefruit, peach and chocolate notes. 

Try before you stock up with a 1/2 pound sample!!",,,,,,,
"Costa Rica: El Conquistador, Tarrazu",https://www.coffeebeancorral.com/product/Costa-Rica-El-Conquistador-Tarrazu__CRELCON.aspx,$8.85,CRELCON,5.0,,Costa Rica,Tarrazu,Conventional,Washed,"Caturra, Catuai","1,200 - 1,900 masl",December - February,,No,No,No,No,"Fruity, nutty characteristics that make this region’s coffees famous. Brightness, body, complexity, aroma and good balance are all clearly apparent.",6,4,5,4,5,4,1,4,4,1,4,1,1,2,"These Costa Rican coffee beans come from one of the exceptional coffee farms in the Tarrazu region. You get a premium Tarrazu at a non-premium price from Hacienda La Minita. This arabica bean is a classic Tarrazu exhibiting the fruity, nutty characteristics that make this region's coffees famous. Brightness, body, complexity, aroma and good balance are all clearly apparent. It has the classic piquant acidity and lively winey flavor expected of the region’s best coffees. Cupping Notes: Well balanced with notes of lush tropical fruit and bittersweet chocolate and has a smooth pronounced body. Try before you stock up with a 1/2 pound sample!",,,,,,,
"Costa Rica: Finca Corralar Microlot, Los Santos",https://www.coffeebeancorral.com/product/Costa-Rica-Finca-Corralar-Microlot__CRSANTOS.aspx,$12.95,CRSANTOS,,,Costa Rica,Los Santos,Conventional,Natural,San Isidro 48,"1,143 - 1,524 masl",March - May,Rain Forest Alliance,No,No,Yes,No,"Lime, plum, orange, and blackberry notes with dark chocolate depth; syrupy body, bright fruit-forward acidity; complex fruit sweetness with rich finish.",6,6,6,6,6,6,1,3,1,1,4,1,3,1,"This Rainforest Alliance Certified natural processed coffee comes from Finca Corralar, a microlot produced by the renowned Hacienda La Minita in Costa Rica's Los Santos region. Los Santos, one of Costa Rica's premier coffee-growing areas, provides ideal high-altitude conditions and volcanic soils that create exceptional flavor development in this carefully selected microlot.


Hacienda La Minita is recognized for its rigorous quality standards and commitment to sustainable agriculture, with Rainforest Alliance certification reflecting their dedication to environmental stewardship and responsible farming practices. The natural processing method enhances the coffee's inherent fruit-forward characteristics, allowing the sugars from the coffee cherry to fully penetrate the beans during the extended drying period.


The microlot designation indicates this coffee represents a small, exceptional batch that has been separated and processed independently to showcase its unique terroir and processing characteristics. The combination of bright citrus (lime and orange), stone fruit (plum), berry (blackberry), and rich dark chocolate creates remarkable complexity, while the syrupy body provides structure for the vibrant fruit flavors—demonstrating why Costa Rican naturals are gaining recognition alongside the country's traditionally washed offerings.

Cupping Notes: Lime, plum, orange, and blackberry notes with dark chocolate depth; syrupy body, bright fruit-forward acidity; complex fruit sweetness with rich finish.
Try before you stock up with a 1/2 pound sample!",,,,,,,
"Costa Rica: Finca El Rinconcito Black Honey, El Cedral",https://www.coffeebeancorral.com/product/Costa-Rica-Finca-El-Rinconcito__CRCONCITO.aspx,$12.60,CRCONCITO,4.0,,Costa Rica,El Cedral,Conventional,Honey,"Catuai, Obata","1,143 - 1,524 masl",March - May,,No,No,Yes,No,,6,1,1,1,1,1,1,1,1,1,1,1,1,1,,,,,,,,
"Costa Rica: La Gladiola, Tarrazu",https://www.coffeebeancorral.com/product/Costa-Rica-La-Gladiola__CRLAGLAD.aspx,$7.70,CRLAGLAD,5.0,,Costa Rica,Tarrazu,Conventional,Washed,"Caturra, Catuai","1,300 - 1,800 masl",November - February,,No,No,No,No,"La Gladiola exhibits a wonderful acidity, good body with some citrus cocoa notes.",4,6,5,4,6,4,1,3,1,2,4,1,1,1,"If you like La Magnolia, you will fall in love with La Gladiola! The fruit that comprises La Gladiola comes from the Western portion of the Tarrazu valley. The fruit is purchased from specific farmers, process it at La Minita's mill, Beneficio del Rio Tarrazu and kept separate from their other trademark coffee beans. Cupping Notes: Wonderful acidity, good body with some citrus and cocoa notes.Try before you stock up with a 1/2 pound sample!",,,,,,,
"Costa Rica: La Magnolia, Tres Rios",https://www.coffeebeancorral.com/www/Products/Costa-Rica-Tres-Rios---La-Magnolia-SHB-__CRTR-LAMAG.aspx,$8.90,CRLAMAG,5.0,,Costa Rica,Tres Rios,Conventional,Washed,"Caturra, Catuai","1,200 - 1,650 masl",December - February,,No,No,No,No,"Cupping Notes: Sparkling, clean, lemon-orange brightness with chocolate and nutty overtones that carry through to the long, complex finish",6,1,1,1,1,1,1,1,1,1,1,1,1,1,"What a fitting name for this wonderfully sweet and aromatic coffee! The La Magnolia is one of the finest Tres Rios coffees we've ever offered, brought to you by the same people who bring you the La Minita Terrazu.The La Magnolia is a beautifully prepped, remarkably well-rounded, exceptionally well-balanced, complex coffee. If you're in search of a special Costa Rican coffee (and even if you're not), this may be the one.",,,,,,,
"Costa Rica: La Minita Estate, Tarrazu",https://www.coffeebeancorral.com/www/Products/Costa-Rica---LaMinita-Tarrazu__CRLAMINITA.aspx,$10.35,CRLAMINITA,5.0,,Costa Rica,Tarrazu,Conventional,Washed,Caturra,"1,143 - 1,524 masl",March - May,,No,No,Yes,No,"Brilliant acidity, a medium body, and sweet flavors of orange citrus, caramelized sugar, and fine chocolate. It is impeccably balanced with a long, satisfying finish",5,4,6,5,6,5,1,4,1,1,4,1,1,4,"Each coffee parcel differentiates from its neighbors by having its own micro-climate, but the Costa Rica La Minta is not combined with any other farms in a cooperative scenario. Each coffee is milled by itself to maintain integrity, and workers only pick cherries when they have fully ripened. The farm uses acclaimed gardening techniques all by hand. 

The La Minita Tarrazu sports beautiful honeysuckle-like blossoms after the initial rain and its birthplace is considered one of the best coffee origins in the world. A Rainforest Certified Alliance coffee, these beans come with the guarantee of a better life for the people and land it comes from––better infrastructure, a more sustainable ecosystem, farming education, and gender equality. Estate owners watch over every process to ensure every bean you roast reaches perfection. 

Cupping Notes: Brilliant acidity, a medium body, and sweet flavors of orange citrus, caramelized sugar, and fine chocolate. It is impeccably balanced with a long, satisfying finish.",,,,,,,
"Costa Rica: Organic La Amistad, Coto Brus",https://www.coffeebeancorral.com/product/Costa-Rica-Organic-La-Amistad__CRORG.aspx,$11.70,CRORGAMISTAD,5.0,,Costa Rica,Coto Brus,Organic,Washed,"Caturra, Catuai","1,220 - 1,524 masl",January - March,Organic,Yes,No,No,No,Brown sugar sweetness with milk chocolate and a fruity orange finish. Expect a full-bodied zing in your cup!,4,5,5,4,5,5,1,4,1,3,4,1,1,4,"Hacienda la Amistad, located in Coto Brus, a canton in the province of Puntarenas, Costa Rica, is owned and operated by Roberto Montero, a third-generation coffee farmer. Roberto’s grandfather first came to the area in the early 1900's as part of a team surveying the border between Costa Rica and the newly formed country of Panama. This organic coffee embodies all the good qualities you look for in a high-grown Costa Rican. Cupping notes: Brown sugar sweetness with milk chocolate and a fruity orange finish. Expect a full-bodied zing in your cup! Try before you buy with a 1/2lb sample!!",,,,,,,
Costa Rica: Romelia SHB,https://www.coffeebeancorral.com/product/Costa-Rica-Romelia-SHB__CRROMELIA.aspx,$9.80,CRROMELIA,,,,,Conventional,Washed,,,,,No,No,Yes,No,"Velvety creamy body, bright acidity, and flavors of milk chocolate, citrus, caramel, and green apple.",5,3,5,4,5,3,1,4,2,2,3,1,1,1,"Romelia SHB EP comes from the cloudy region of the Palmichal rainforest. Bordering the historic and well-known coffee zone of Tarrazu, Mauel Rojas Arias pioneered coffee growing in the Palmichal region. Many farmers observed the success of Don Manuel had with coffee and converted their own sugar plantations into coffee farms. After Don Manuel's death, he left his farm to his sister, Romelia. Thanks to her strength and perseverance, Dona Romeila was able to sustain the quality of her farm. With this, the Beneficio Palmichal was founded in 1933, opening and revolutionizing the area for years to come.",,,,,,,
"Dominican Republic: Organic Ramirez Red Honey, Jarabacoa",https://www.coffeebeancorral.com/product/Dominican-Republic-Organic-Ramirez-Honey-Process__DOMRAMHONEY.aspx,$12.50,DOMRAMHONEY,4.5,,Dominican Republic,Jarabacoa,Organic,Honey,Red Caturra,"1,400 masl",January - May,Organic,Yes,No,No,No,,6,1,1,1,1,1,1,1,1,1,1,1,1,1,,,,,,,,
"Dominican Republic: Organic Ramirez Washed, Jarabacoa",https://www.coffeebeancorral.com/coffeebeancorral.com/product/Dominican-Republic-Organic-Ramirez-Washed__DOMRAMZORGWASH.aspx,$12.50,DOMRAMZORGWASH,4.5,,Dominican Republic,Jarabacoa,Organic,Washed,Caturra,"1,400 masl",January - May,Organic,Yes,No,No,No,"Smooth creamy body. Sweet undertones, butter, cream, and nuts.",4,5,5,6,3,6,1,3,3,3,1,1,1,4,"Ramirez Estate Bio: In the Dominican Republic, the family-owned Ramirez Estate run by the third generation employs over 400 workers who live and work on the property and make nearly 300% higher wages than Fair Trade Standard. Before the Ramirez family purchased the land in the early 1990s, the land was impotent and bare––natural water springs had long since dried up and farmers had only been raising cattle. Today, the Ramirez Estate is one of the most environmentally-progressive and socially-conscious proprietorships in the world because they recycle materials used during coffee bean processing. First, coffee cherry parts that would normally be thrown out are converted into natural gas through fermentation––in turn, this natural gas powers their facility. Next, the used water is also recycled, filtered, and returned to water systems. Lastly, cherry pulps are added to a compost pile where they’re used as fertilizer useful to nearby farms. In addition to creating exceptional coffee, the Ramirez Estate also gives back to its community in countless ways. By building schools in rural areas, local children no longer have to walk nearly twenty miles a day, and after donating books and computers, students have more opportunities to learn. The Ramirez Estate also allows other farmers in the Dominican Republic to use their processing plant to assist in coffee export.  The pictures seen on our website are part of our personal experience touring the estate and meeting the Ramirez family––they are humble, honest, and produce some of the highest-scoring coffees we carry. Washed: This complex washed-processed coffee is dried with unique rotating dryers, and it comes from the certified Ramirez Estate in the Jarabacoa region of the Dominican Republic. It’s grown at 1,400 meters above sea level with an arabica variety of caturra. Within its process, the Ramirez Washed bean holds the inner workings of the cherry in highest regard––the layers of fruit are stripped, and cherries are almost immediately de-pulped through drying to give the coffee a clean, robust flavor––there is little to no fermentation. Cupping notes: Smooth creamy body. Sweet undertones, butter, cream, and nuts. The finish turns to a sweet vanilla soy milk flavor. Exactly what you expect from an island coffee. Learn more about Dominican coffee beans with our DR coffee guide. Try before you stock up with a 1/2 pound sample!",,,,,,,
